{
  "contracts": {
    "apiVersion": "0.1.0",
    "sseSchemaVersion": "1.0"
  },
  "generator": {
    "name": "generate_release_manifest.py",
    "syftVersion": "v1.20.0"
  },
  "imageGates": {
    "CE_STACK_LIVE_IMAGE": "0",
    "CE_STACK_OBJECT_STORE_IMAGE": "0",
    "CE_STACK_PARSERS_IMAGE": "0",
    "CE_STACK_PREVIEW_IMAGE": "0"
  },
  "lightrag": {
    "pinnedVersion": "1.4.16",
    "vendoredVersion": "1.4.16"
  },
  "locks": {
    "packageLockSha256": "aaae22fc481d022a30ffb4ba369ecf9d75d8ef2373f68dad65165fde226bdb2b",
    "uvLockSha256": "5857a0092c9fa0b5c6fef023372ecfd93aca809079aca3e0db74153839cdeb26"
  },
  "packages": {
    "boto3": "1.43.57",
    "docling": "2.115.0",
    "httpx": "0.28.1",
    "openai": "2.48.0",
    "python-docx": "1.2.0",
    "reductoai": "0.22.0"
  },
  "platform": "linux/amd64",
  "profile": "pr",
  "rendererIds": [
    "ce-preview-v1",
    "ce-preview-text-v1",
    "ce-preview-pdf-passthrough-v1"
  ],
  "schema": {
    "alembicHead": "d4e7a1b92c80"
  },
  "schemaVersion": "1",
  "source": {
    "dirty": true,
    "gitSha": "5b574c90fc9b266bea7ef14242028c7a9e517161"
  },
  "upstreamImages": {
    "mc": {
      "tag": "minio/mc:RELEASE.2024-11-17T19-35-56Z"
    },
    "minio": {
      "tag": "minio/minio:RELEASE.2024-12-18T13-15-44Z"
    },
    "postgres": {
      "tag": "postgres:16"
    }
  }
}
